{
  "protocol": "tezuri.media-asset-receipt",
  "version": 1,
  "articleId": "article:patina",
  "originalFileName": "patina.png",
  "fileName": "aaaaaaaaaaaaaaaaaaaaaaaaaaaaaaaaaaaaaaaaaaaaaaaaaaaaaaaaaaaaaaaa.png",
  "relativePath": "src/writing/patina/media/aaaaaaaaaaaaaaaaaaaaaaaaaaaaaaaaaaaaaaaaaaaaaaaaaaaaaaaaaaaaaaaa.png",
  "mediaType": "image/png",
  "sha256": "aaaaaaaaaaaaaaaaaaaaaaaaaaaaaaaaaaaaaaaaaaaaaaaaaaaaaaaaaaaaaaaa",
  "byteLength": 2048,
  "deduplicated": false
}
